{
  "$schema": "../schemas/dtc.schema.json",
  "schemaVersion": "1.0.0",
  "definitionVersion": "0.2.0-documentary",
  "verificationStatus": "Unverified",
  "productionEligible": false,
  "definitionId": "roadmaster-1994-dtc-80",
  "code": "80",
  "codeFormat": "GM OBD-I two-digit",
  "system": "Transmission",
  "title": "Transmission component slipping",
  "plainEnglishMeaning": "The PCM detected an unexpected speed difference while evaluating transmission or torque-converter operation.",
  "enableCriteria": "The reproduced Roadmaster chart describes monitoring in D3 or D4, indicated gears 2 through 4, with the torque-converter clutch commanded locked.",
  "failureCriteria": "The exact permitted speed difference and duration are not yet verified.",
  "maturityCriteria": null,
  "pcmFallbackAction": [],
  "driverSymptoms": [],
  "likelyCauses": [
    { "rank": 1, "category": "Hydraulic or friction", "cause": "Torque-converter clutch or internal transmission slip" },
    { "rank": 2, "category": "Input", "cause": "Incorrect range-pressure-switch information" },
    { "rank": 3, "category": "Connection", "cause": "Poor contact at the transmission pass-through connector" }
  ],
  "falsePositiveConditions": ["Incorrect range information or a connector fault can corrupt the PCM's slip evaluation."],
  "confirmatoryTests": [
    "Confirm that the reported range agrees with the selector.",
    "Record engine speed, output speed, gear, and torque-converter-clutch command during a safe steady cruise.",
    "Measure hydraulic pressure if the electrical commands are correct but slip is repeatable."
  ],
  "safetyLevel": "Avoid heavy load until repeatable slip is evaluated",
  "sourceReferences": [
    "PORTAL-DIAGNOSTOV-1994-ROADMASTER-CODES-2026-07-30: Code 80 section, lines 1345-1355",
    "LT1-DATASTREAM-DEFINITIONS-2026-07-30:A276.DS logged DTC bit"
  ]
}
