{
  "$schema": "../schemas/dtc.schema.json",
  "schemaVersion": "1.0.0",
  "definitionVersion": "0.2.0-documentary",
  "verificationStatus": "Unverified",
  "productionEligible": false,
  "definitionId": "roadmaster-1994-dtc-84",
  "code": "84",
  "codeFormat": "GM OBD-I two-digit",
  "system": "Transmission electrical",
  "title": "3–2 control-solenoid circuit fault",
  "plainEnglishMeaning": "The PCM detected an electrical problem involving the 3–2 control-solenoid circuit.",
  "enableCriteria": null,
  "failureCriteria": "Exact application-specific feedback criteria are not yet verified.",
  "maturityCriteria": null,
  "pcmFallbackAction": [],
  "driverSymptoms": [],
  "likelyCauses": [
    { "rank": 1, "category": "Connection", "cause": "Poor contact at a transmission connector" },
    { "rank": 2, "category": "Power supply", "cause": "Open ignition-feed circuit or fuse problem" },
    { "rank": 3, "category": "Wiring", "cause": "Short in the internal transmission harness" },
    { "rank": 4, "category": "Component", "cause": "3–2 control-solenoid electrical fault" }
  ],
  "falsePositiveConditions": ["A shared ignition-feed fault can set multiple solenoid codes at once."],
  "confirmatoryTests": [
    "Check for other transmission electrical codes that share the ignition feed.",
    "Verify power at the 3–2 control-solenoid circuit.",
    "Test the internal harness and solenoid for an open or short."
  ],
  "safetyLevel": "Service soon",
  "sourceReferences": [
    "PORTAL-DIAGNOSTOV-1994-ROADMASTER-CODES-2026-07-30: Code 84 section, lines 1399-1407",
    "LT1-DATASTREAM-DEFINITIONS-2026-07-30:A276.DS logged DTC bit"
  ]
}
