{
  "$schema": "../schemas/dtc.schema.json",
  "schemaVersion": "1.0.0",
  "definitionVersion": "0.2.0-documentary",
  "verificationStatus": "Unverified",
  "productionEligible": false,
  "definitionId": "roadmaster-1994-dtc-72",
  "code": "72",
  "codeFormat": "GM OBD-I two-digit",
  "system": "Transmission",
  "title": "Vehicle-speed signal was lost",
  "plainEnglishMeaning": "The PCM had detected vehicle speed and then lost the speed-sensor signal.",
  "enableCriteria": "Vehicle-speed input was previously present.",
  "failureCriteria": "The previously detected vehicle-speed signal disappears.",
  "maturityCriteria": null,
  "pcmFallbackAction": [],
  "driverSymptoms": [],
  "likelyCauses": [
    { "rank": 1, "category": "Connection", "cause": "Intermittent connection at the vehicle-speed sensor or PCM" },
    { "rank": 2, "category": "Wiring", "cause": "Harness damage, including heat damage near the exhaust" },
    { "rank": 3, "category": "Component", "cause": "Vehicle-speed sensor fault" }
  ],
  "falsePositiveConditions": ["An intermittent connector can imitate a failed speed sensor."],
  "confirmatoryTests": [
    "Watch the vehicle-speed reading while safely reproducing the condition.",
    "Inspect and gently move the sensor and PCM harness connections.",
    "Inspect harness routing near hot exhaust components."
  ],
  "safetyLevel": "Service soon",
  "sourceReferences": [
    "PORTAL-DIAGNOSTOV-1994-ROADMASTER-CODES-2026-07-30: Code 72 section, lines 1224-1234",
    "LT1-DATASTREAM-DEFINITIONS-2026-07-30:A276.DS logged DTC bit"
  ]
}
